{
  "schema_version": "lab.run.v1",
  "run_id": "run-20260918-local-001",
  "experiment_id": "verification-harness-2026-09-18-real-data-abcd-verification",
  "status": "pass",
  "upstream_revision": "0f16e2867befa6840783e58be38c9efb9229d742",
  "command": "python -m harness.cli run --arms A,B,C --provider local --run-id run-20260918-local-001",
  "started_at": "2026-09-18T20:45:00Z",
  "finished_at": "2026-09-18T20:50:00Z",
  "environment": {
    "python": "3.12.3",
    "provider": "local",
    "model_identity": "LocalExtractiveScoreProvider",
    "z3": "unavailable",
    "symai": "unavailable",
    "luna": "unavailable",
    "note": "Gold-blind extractive substitute. Not mock. Not Luna. Legalbench revision daec8237410aa23e3faf4bc41ad8b3a7e1696826."
  },
  "outputs": ["records.json", "metrics.json", "combined_metrics.json", "leak_export_proof.txt"],
  "notes": "Primary real-data A/B/C run on the frozen 50+50 sample. Luna was unavailable; results are the documented local substitute."
}
